{
  "assurancePackVersion": "0.2",
  "profile": "uas-small",
  "policy": "eu-north-star",
  "specVersion": "0.2.0",
  "verifier": {
    "name": "tasc-verify",
    "version": "0.1.0"
  },
  "evidenceMap": {
    "evidenceMapVersion": "0.1",
    "system": {
      "systemId": "sys_urn:example:uas-small:alpha",
      "releaseId": "rel_2026-02-11_uas-small",
      "gitCommit": "26aa65d2a9f6",
      "build": {
        "buildSystem": "reproducible-build",
        "artifactDigest": "sha256:5593054903eae87d53607d24865e7e416432d8ab1a82d2a73cb2bacfbec218eb",
        "configDigest": "sha256:7180ebad23d580da61b745fcbece074619de0c4dba3eb0ab6c3498da7ac6cec4"
      }
    },
    "tasc": {
      "specVersion": "0.2.0",
      "profile": "uas-small",
      "verifier": {
        "name": "tasc-verify",
        "version": "0.1.0"
      }
    },
    "topology": {
      "graphDigest": "sha256:b60f6ab24614669eaefb855e215443827492f26618daf976de6893f930c29296",
      "nodes": [
        {
          "id": "n_ai_planner",
          "type": "autonomy_planner"
        },
        {
          "id": "n_safety_kernel",
          "type": "safety_kernel"
        },
        {
          "id": "n_interlock_gate",
          "type": "interlock_gate",
          "defaultClosed": true
        },
        {
          "id": "n_actuator_bus",
          "type": "actuator_integrator"
        }
      ],
      "edges": [
        {
          "from": "n_ai_planner",
          "to": "n_safety_kernel",
          "signal": "intent_vector"
        },
        {
          "from": "n_safety_kernel",
          "to": "n_interlock_gate",
          "signal": "cmd_authorized"
        },
        {
          "from": "n_interlock_gate",
          "to": "n_actuator_bus",
          "signal": "actuator_command"
        }
      ],
      "conformanceAssertions": [
        {
          "id": "A001",
          "claim": "Every actuator output path is mediated by interlock_gate",
          "status": "proven",
          "proofRef": "sha256:78ed8ff0ab16f9d7f1a9048e7925e6b5856d2026ee92cbdf86d6d88041f760cf"
        },
        {
          "id": "A002",
          "claim": "Only safety_kernel may command interlock_gate authority",
          "status": "proven",
          "proofRef": "sha256:2c73780624526559ee43e6ca6c1d3d54dba93043bc183e014cd25ee08aaa6191"
        }
      ]
    },
    "runtimeSafety": {
      "heartbeat": {
        "minHz": 10,
        "failToSafeWithinMs": 200
      },
      "safeStateDefinition": "profile:uas-small:safe-set:v0.1"
    },
    "logs": {
      "schemaVersion": "0.2",
      "signedMerkleLog": {
        "root": "sha256:3511e71c0a4c216c1b529242a3fae3e458ccff9a54db5ac0338ecf4541326385",
        "signature": "hQ9pwuVJuFTuS6EnOqsir8ipIO+AMjNsKXIfCgCmwkx8C6N08smGE9dgfE2OM9odGhX59s5AtvVderbcaVgrxrJqKY4gGtRYlHsQr12nc5hMLDTWgJwpARGAmNvJtPGYnqUbgBsUj/dV+HZZBhxCgbQyFKQtz5RtoqP4H7kSofYmsRnm4oBXIlKmrSJ1WhPsezXru2n6Yk9SMhPdiC+AVKaSOYU56IDp/JLxtgzLzcg7KrBuzFx2ojoCSAmMRwXcHr027HaCZdfuyq9PHxY8R2RFbG5JN+bESuQBHsrDyYRbFBNSZF2QlQHE/eRuNkOx81VA2tFST2f5E6//4ZA+SA==",
        "signerKeyId": "kid:tasc-ta2-uas-small"
      },
      "retentionPolicy": {
        "minimumMonths": 6,
        "operatorPolicyMonths": 24
      }
    },
    "attestation": {
      "level": "TA2",
      "evidenceRef": "sha256:b381ab58ad1ce542198275f0d97e2f283f7481fdfa166a911aa67c2f45784ad1"
    },
    "replay": {
      "recipeRef": "sha256:9fe185ac47d894adb65e8e069cdd702fc4cf280f091ad8ea439f3d973d234391",
      "containerDigest": "sha256:0852fb5bfd371fd884eaf32c279f2cb8e1f159b9842c42f1dfa71ef567ea9c3f",
      "inputsDigest": "sha256:938560578e026d2991b3835decdc51fd1aad5f6c3b923c3f02a4607896d80e10",
      "seedsDigest": "sha256:bf4e4577cf9d510fd40e18bcf70e84b6da19fec40c5cbdf506f423aef94500f4",
      "configDigest": "sha256:1fdea0037ae979b0d5d20cac836dd2a87074fd01b732b64cfd4f719934c42c5e",
      "buildDigest": "sha256:c51ed1151f2f5cd4beb5cffc5ef08ccd6ca422e78ddc28443ceb69f0d1578934",
      "environmentDigest": "sha256:a37180b19d198d2cca88c73524e0586c59d5e57c02a98ecf1b493863a391908c"
    },
    "incident": {
      "ontologyVersion": "0.1",
      "templates": [
        "tasc-incident-initial-v0.1",
        "tasc-incident-pack-v0.1"
      ],
      "reportingWindowsDays": {
        "standard": 15,
        "widespread": 2,
        "fatal": 10
      }
    }
  },
  "conformanceReport": {
    "tascVerifyVersion": "0.1.0",
    "specVersion": "0.2.0",
    "profile": "uas-small",
    "policy": "eu-north-star",
    "bundleDigest": "sha256:d4a7ce44189a3786be76f0ff92a7b81ac002c93bd1d7e601dce27046963c7deb",
    "requireTa": "TA2",
    "requireTransparency": [
      "rekor",
      "mirror"
    ],
    "result": "PASS",
    "checks": [
      {
        "id": "CHK_SCHEMA_ASSURANCEPACK",
        "result": "PASS",
        "message": "assurance pack envelope present | remediation: Ensure assurance pack contains all required top-level sections and valid JSON object structure."
      },
      {
        "id": "CHK_SCHEMA_EVIDENCEMAP",
        "result": "PASS",
        "message": "evidence map present | remediation: Regenerate EvidenceMap from current topology and include required sub-sections."
      },
      {
        "id": "CHK_SCHEMA_CONFORMANCE_REPORT",
        "result": "PASS",
        "message": "conformance report present | remediation: Re-run tasc-verify and embed the verifier-produced report without manual edits."
      },
      {
        "id": "CHK_SCHEMA_SIGNED_LOG",
        "result": "PASS",
        "message": "signed operational log present | remediation: Emit signedOperationalLog with schemaVersion, signerKeyId, signature, root, and events."
      },
      {
        "id": "CHK_SCHEMA_REPLAY_RECIPE",
        "result": "PASS",
        "message": "replay recipe present | remediation: Include all replay digests and recipeVersion in replayRecipe."
      },
      {
        "id": "CHK_SCHEMA_ATTESTATION",
        "result": "PASS",
        "message": "attestation evidence present | remediation: Provide complete attestationEvidence payload matching schema requirements."
      },
      {
        "id": "CHK_SCHEMA_INCIDENT_INITIAL",
        "result": "PASS",
        "message": "incident initial template present | remediation: Include incidentInitialTemplate with required reporting windows fields."
      },
      {
        "id": "CHK_SCHEMA_INCIDENT_PACK",
        "result": "PASS",
        "message": "incident full pack template present | remediation: Include incidentPackTemplate with requiredArtifacts and fullPackSlaDays."
      },
      {
        "id": "CHK_SCHEMA_TRANSPARENCY_REKOR",
        "result": "PASS",
        "message": "rekor transparency proof present | remediation: Include transparencyProofs.rekor with required proof fields."
      },
      {
        "id": "CHK_SCHEMA_TRANSPARENCY_MIRROR",
        "result": "PASS",
        "message": "mirror transparency proof present | remediation: Include transparencyProofs.mirror with required proof fields."
      },
      {
        "id": "CHK_SCHEMA_BADGE_ENTRY",
        "result": "PASS",
        "message": "badge entry present | remediation: Include badgeEntry with badgeId, badgeType, and active status fields."
      },
      {
        "id": "CHK_PROFILE_MATCH",
        "result": "PASS",
        "message": "profile matches uas-small | remediation: Regenerate bundle with matching --profile and evidence profile metadata."
      },
      {
        "id": "CHK_POLICY_MATCH",
        "result": "PASS",
        "message": "policy matches eu-north-star | remediation: Set bundle policy to match verifier invocation policy."
      },
      {
        "id": "CHK_TOPOLOGY_INTERLOCK_MEDIATION",
        "result": "PASS",
        "message": "all actuator paths mediated by interlock gate | remediation: Ensure every actuator path flows through interlock_gate."
      },
      {
        "id": "CHK_TOPOLOGY_AUTHORITY_EXCLUSIVITY",
        "result": "PASS",
        "message": "interlock authority exclusive to safety kernel | remediation: Ensure only safety_kernel sources authority edges into interlock_gate."
      },
      {
        "id": "CHK_TOPOLOGY_ASSERTION_REFS",
        "result": "PASS",
        "message": "required assertion refs are proven and hash-addressed | remediation: Populate A001/A002 assertions as proven with sha256 proofRef values."
      },
      {
        "id": "CHK_ARTIFACT_HASH_INTEGRITY",
        "result": "PASS",
        "message": "artifact hashes validated | remediation: Recompute artifact digests and ensure files exist beside bundle."
      },
      {
        "id": "CHK_LOG_HASH_CHAIN",
        "result": "PASS",
        "message": "log hash chain verified | remediation: Rebuild event chain so prevHash/hash/root are internally consistent."
      },
      {
        "id": "CHK_LOG_SIGNATURE",
        "result": "PASS",
        "message": "log signature validated with PKCS11 key source | remediation: Re-sign operational log root with declared signerKeyId."
      },
      {
        "id": "CHK_RETENTION_EU_MINIMUM",
        "result": "PASS",
        "message": "retention minimum satisfied (6 months) | remediation: Set evidenceMap.logs.retentionPolicy.minimumMonths to at least 6."
      },
      {
        "id": "CHK_REPLAY_COMPLETENESS",
        "result": "PASS",
        "message": "replay completeness checks passed | remediation: Populate seeds/build/config/environment/container digests and profile."
      },
      {
        "id": "CHK_ATTESTATION_TA2",
        "result": "PASS",
        "message": "attestation TA2 satisfies minimum TA2 | remediation: Provide TA2 attestation meeting trust policy and lifecycle constraints."
      },
      {
        "id": "CHK_INCIDENT_WINDOWS_EU",
        "result": "PASS",
        "message": "incident window policy checks passed | remediation: Set incident windows to 15/2/10 and fullPackSlaDays <= 10."
      },
      {
        "id": "CHK_TRANSPARENCY_REKOR_PROOF",
        "result": "PASS",